{
  "version": 1,
  "files": {
    "invoice.rb": {
      "sha": "304c3353b80e20f65751ce858e8be39c7b6b83d42cb656076ce1503c1103235b",
      "bytes": 323
    },
    "mailer.rb": {
      "sha": "926883369c7bf3aa2926dd066959cfd516c6aa7e27b166323a46fe2d05208ffc",
      "bytes": 159
    },
    "main.rb": {
      "sha": "4a494e27a6a3edd452aef7ad7f78d0233f8ea5226527ea210d1b946717bd4096",
      "bytes": 113
    }
  },
  "layers": [
    {
      "id": "defs.attributes",
      "kind": "static",
      "producer": "fixture@1",
      "marks": [
        {
          "file": "invoice.rb",
          "start": 83,
          "end": 89,
          "symbol": "Invoice#items",
          "role": "definition",
          "data": {
            "scope": null
          }
        }
      ]
    },
    {
      "id": "defs.classes",
      "kind": "static",
      "producer": "fixture@1",
      "marks": [
        {
          "file": "invoice.rb",
          "start": 61,
          "end": 68,
          "symbol": "Invoice",
          "role": "definition",
          "data": {
            "scope": null
          }
        },
        {
          "file": "mailer.rb",
          "start": 34,
          "end": 40,
          "symbol": "Mailer",
          "role": "definition",
          "data": {
            "scope": null
          }
        }
      ]
    },
    {
      "id": "defs.methods",
      "kind": "static",
      "producer": "fixture@1",
      "marks": [
        {
          "file": "invoice.rb",
          "start": 97,
          "end": 107,
          "symbol": "Invoice#initialize",
          "role": "definition",
          "data": {
            "scope": "Invoice#initialize",
            "effects": {
              "verdict": "impure",
              "direct": [
                "state"
              ],
              "via": {}
            }
          }
        },
        {
          "file": "invoice.rb",
          "start": 147,
          "end": 154,
          "symbol": "Invoice#summary",
          "role": "definition",
          "data": {
            "scope": "Invoice#summary",
            "effects": {
              "verdict": "pure",
              "direct": [],
              "via": {}
            }
          }
        },
        {
          "file": "invoice.rb",
          "start": 280,
          "end": 288,
          "symbol": "Invoice#overdue?",
          "role": "definition",
          "data": {
            "scope": "Invoice#overdue?",
            "effects": {
              "verdict": "pure",
              "direct": [],
              "via": {}
            }
          }
        },
        {
          "file": "mailer.rb",
          "start": 47,
          "end": 53,
          "symbol": "Mailer#notify",
          "role": "definition",
          "data": {
            "scope": "Mailer#notify",
            "effects": {
              "verdict": "impure",
              "direct": [],
              "via": {
                "io": [
                  "Mailer#deliver"
                ]
              }
            }
          }
        },
        {
          "file": "mailer.rb",
          "start": 121,
          "end": 128,
          "symbol": "Mailer#deliver",
          "role": "definition",
          "data": {
            "scope": "Mailer#deliver",
            "effects": {
              "verdict": "impure",
              "direct": [
                "io"
              ],
              "via": {}
            }
          }
        }
      ]
    },
    {
      "id": "effects.calls",
      "kind": "static",
      "producer": "fixture@1",
      "marks": [
        {
          "file": "mailer.rb",
          "start": 94,
          "end": 101,
          "symbol": "Mailer#deliver",
          "role": "reference",
          "data": {
            "kind": "calls",
            "via": "Mailer#deliver",
            "effects": [
              "io"
            ],
            "scope": "Mailer#notify"
          }
        },
        {
          "file": "main.rb",
          "start": 97,
          "end": 103,
          "symbol": "Mailer#notify",
          "role": "reference",
          "data": {
            "kind": "calls",
            "via": "Mailer#notify",
            "effects": [
              "io"
            ],
            "scope": null
          }
        }
      ]
    },
    {
      "id": "effects.io",
      "kind": "static",
      "producer": "fixture@1",
      "marks": [
        {
          "file": "mailer.rb",
          "start": 139,
          "end": 143,
          "symbol": null,
          "role": "reference",
          "data": {
            "kind": "io",
            "what": "output",
            "scope": "Mailer#deliver"
          }
        }
      ]
    },
    {
      "id": "effects.state",
      "kind": "static",
      "producer": "fixture@1",
      "marks": [
        {
          "file": "invoice.rb",
          "start": 119,
          "end": 125,
          "symbol": "Invoice@items",
          "role": "write",
          "data": {
            "kind": "state",
            "scope": "Invoice#initialize"
          }
        }
      ]
    },
    {
      "id": "exec.path",
      "kind": "dynamic",
      "producer": "fixture@1",
      "marks": [
        {
          "file": "invoice.rb",
          "start": 93,
          "end": 114,
          "symbol": null,
          "role": "executed",
          "data": {
            "scope": "Invoice#initialize"
          }
        },
        {
          "file": "invoice.rb",
          "start": 119,
          "end": 133,
          "symbol": null,
          "role": "executed",
          "data": {
            "scope": "Invoice#initialize"
          }
        },
        {
          "file": "invoice.rb",
          "start": 136,
          "end": 139,
          "symbol": null,
          "role": "executed",
          "data": {
            "scope": "Invoice#initialize"
          }
        },
        {
          "file": "invoice.rb",
          "start": 143,
          "end": 154,
          "symbol": null,
          "role": "executed",
          "data": {
            "scope": "Invoice#summary"
          }
        },
        {
          "file": "invoice.rb",
          "start": 159,
          "end": 168,
          "symbol": null,
          "role": "executed",
          "data": {
            "scope": "Invoice#summary"
          }
        },
        {
          "file": "invoice.rb",
          "start": 173,
          "end": 193,
          "symbol": null,
          "role": "executed",
          "data": {
            "scope": "Invoice#summary"
          }
        },
        {
          "file": "invoice.rb",
          "start": 200,
          "end": 213,
          "symbol": null,
          "role": "executed",
          "data": {
            "scope": "Invoice#summary"
          }
        },
        {
          "file": "invoice.rb",
          "start": 218,
          "end": 221,
          "symbol": null,
          "role": "executed",
          "data": {
            "scope": "Invoice#summary"
          }
        },
        {
          "file": "invoice.rb",
          "start": 226,
          "end": 241,
          "symbol": null,
          "role": "executed",
          "data": {
            "scope": "Invoice#summary"
          }
        },
        {
          "file": "invoice.rb",
          "start": 246,
          "end": 266,
          "symbol": null,
          "role": "executed",
          "data": {
            "scope": "Invoice#summary"
          }
        },
        {
          "file": "invoice.rb",
          "start": 269,
          "end": 272,
          "symbol": null,
          "role": "executed",
          "data": {
            "scope": "Invoice#summary"
          }
        },
        {
          "file": "mailer.rb",
          "start": 43,
          "end": 62,
          "symbol": null,
          "role": "executed",
          "data": {
            "scope": "Mailer#notify"
          }
        },
        {
          "file": "mailer.rb",
          "start": 67,
          "end": 89,
          "symbol": null,
          "role": "executed",
          "data": {
            "scope": "Mailer#notify"
          }
        },
        {
          "file": "mailer.rb",
          "start": 94,
          "end": 107,
          "symbol": null,
          "role": "executed",
          "data": {
            "scope": "Mailer#notify"
          }
        },
        {
          "file": "mailer.rb",
          "start": 110,
          "end": 113,
          "symbol": null,
          "role": "executed",
          "data": {
            "scope": "Mailer#notify"
          }
        },
        {
          "file": "mailer.rb",
          "start": 117,
          "end": 134,
          "symbol": null,
          "role": "executed",
          "data": {
            "scope": "Mailer#deliver"
          }
        },
        {
          "file": "mailer.rb",
          "start": 139,
          "end": 148,
          "symbol": null,
          "role": "executed",
          "data": {
            "scope": "Mailer#deliver"
          }
        },
        {
          "file": "mailer.rb",
          "start": 151,
          "end": 154,
          "symbol": null,
          "role": "executed",
          "data": {
            "scope": "Mailer#deliver"
          }
        },
        {
          "file": "main.rb",
          "start": 54,
          "end": 85,
          "symbol": null,
          "role": "executed",
          "data": {
            "scope": null
          }
        },
        {
          "file": "main.rb",
          "start": 86,
          "end": 112,
          "symbol": null,
          "role": "executed",
          "data": {
            "scope": null
          }
        }
      ]
    },
    {
      "id": "refs.calls",
      "kind": "static",
      "producer": "fixture@1",
      "marks": [
        {
          "file": "invoice.rb",
          "start": 173,
          "end": 178,
          "symbol": "Invoice#items",
          "role": "reference",
          "data": {
            "scope": "Invoice#summary"
          }
        },
        {